{
    "$schema": "../../../spec/0.1.0/tdbs.schema.json",
    "spec_version": "0.1.0",
    "id": "france-cassini-survey-18th-century",
    "name": {
        "canonical": "French Cassini Survey — 18th Century",
        "alias": "The Royal Triangulation",
        "genre": "engraved national survey map",
        "era": "18th century",
        "inspiration_notice": "An unofficial interpretive brief derived from source research and intended to guide original map styling; it does not reproduce or imply endorsement by referenced institutions, publishers, or cartographers.",
        "organization_or_origin": [
            "Kingdom of France",
            "Académie Royale des Sciences context",
            "Cassini family survey tradition",
            "Paris engraving and sheet publication network"
        ]
    },
    "description": {
        "summary": "An engraved Enlightenment-era survey style: cream paper, black/brown copperplate linework, dense place names, roads, rivers, forests, churches and settlements, sheet margins, measured framework, and approximate hachured relief. The map should feel scientific and royal-state systematic, not fanciful pirate parchment. Sacrebleu, but with triangulation.",
        "design_principle": "Express national survey precision through engraved restraint: monochrome or lightly hand-colored linework, dense named geography, hachured relief, road and settlement symbols, neat sheet structure, and formal cloud web mapping platformuche/marginalia.",
        "historical_context": "The Cassini Carte de France was a large national survey project, based on geodetic triangulation and published as adjoining engraved sheets. It represented an unprecedented systematic mapping of France's territory, settlements, roads, hydrography, and relief in the eighteenth century. copperplate engraving black ink impressions on cream/ivory paper hand coloring in selected surviving exemplars",
        "geographic_origin": [
            "Kingdom of France",
            "Académie Royale des Sciences context",
            "Cassini family survey tradition",
            "Paris engraving and sheet publication network"
        ],
        "avoid_misclassification_with": [
            "Nautical portolan chart",
            "decorative Renaissance map",
            "19th-century county atlas",
            "modern French national mapping topographic map",
            "Victorian railway map",
            "fantasy parchment map"
        ]
    },
    "classification": {
        "ranked_intents": [
            {
                "rank": 1,
                "intent": "educational-interpretive",
                "role": "primary",
                "score": 97,
                "rationale": "Teaching, heritage, visitor interpretation, public history, and exhibition use. This brief is ranked 1 with a primary role based on its source classification and curated migration profile."
            },
            {
                "rank": 2,
                "intent": "reference",
                "role": "primary",
                "score": 91,
                "rationale": "General geographic orientation, feature lookup, and broad contextual reading. This brief is ranked 2 with a primary role based on its source classification and curated migration profile."
            },
            {
                "rank": 3,
                "intent": "terrain-relief",
                "role": "hybrid",
                "score": 84,
                "rationale": "Elevation, landform, contours, hillshade, bathymetry, and relief as the principal subject. This brief is ranked 3 with a hybrid role based on its source classification and curated migration profile."
            },
            {
                "rank": 4,
                "intent": "human-geography",
                "role": "hybrid",
                "score": 77,
                "rationale": "Settlements, boundaries, culture, population, political geography, and human networks. This brief is ranked 4 with a hybrid role based on its source classification and curated migration profile."
            }
        ],
        "scales": [
            "regional",
            "local"
        ],
        "label_density": "dense",
        "terrain_emphasis": "context",
        "dimensionality": "2d",
        "interaction_fit": [
            "static",
            "exploratory"
        ],
        "projection_bias": "conformal",
        "mobile_fit": "low",
        "implementation_complexity": "expert",
        "subjects": [
            "settlements from cities to hamlets",
            "roads and paths",
            "rivers and watercourses",
            "forests, parks, and alleys",
            "relief by hachures",
            "churches, abbeys, mills, castles, and other landmarks",
            "sheet grid and survey framework"
        ],
        "visual_keywords": [
            "vintage",
            "ornate",
            "handcrafted",
            "scientific",
            "authoritative",
            "academic"
        ]
    },
    "design_tokens": {
        "colors": {
            "palette": [
                {
                    "name": "aged ivory paper",
                    "value": "#EFE3C6",
                    "roles": [
                        "background",
                        "land"
                    ]
                },
                {
                    "name": "paper shadow tan",
                    "value": "#D6C39A",
                    "roles": [
                        "general"
                    ]
                },
                {
                    "name": "iron gall ink",
                    "value": "#2B261D",
                    "roles": [
                        "labels"
                    ]
                },
                {
                    "name": "sepia ink",
                    "value": "#5B4631",
                    "roles": [
                        "general"
                    ]
                },
                {
                    "name": "faded blue wash",
                    "value": "#B6C7C4",
                    "roles": [
                        "water"
                    ]
                },
                {
                    "name": "faded green wash",
                    "value": "#B9BF8F",
                    "roles": [
                        "vegetation"
                    ]
                },
                {
                    "name": "muted ochre",
                    "value": "#C0A15F",
                    "roles": [
                        "transportation"
                    ]
                },
                {
                    "name": "cloud web mapping platformuche gray",
                    "value": "#7A6C5A",
                    "roles": [
                        "general"
                    ]
                },
                {
                    "name": "ink fade",
                    "value": "#8A7B63",
                    "roles": [
                        "labels"
                    ]
                }
            ],
            "behavior": [
                "Default should be black/sepia engraving on ivory paper.",
                "Use color only as transparent hand-applied wash, never as modern flat thematic fill.",
                "If roads are highlighted, use ochre or slightly heavier ink rather than bright modern colors.",
                "Forests may use a pale green wash plus engraved tree/texture marks; water may use faint blue wash plus black river engraving."
            ],
            "avoid": [
                "modern saturated choropleths",
                "French national mapping contemporary greens/blues/magentas",
                "rainbow palettes",
                "neon highlights",
                "opaque digital fills"
            ]
        },
        "typography": {
            "character": "Engraved old-style serif and copperplate-like italic mix. Place labels should feel hand-engraved, with elegant variation in size, slope, spacing, and curvature. Avoid Victorian display fonts; Cassini is earlier and more scientific.",
            "font_families": [
                "Cormorant Garamond",
                "Libre Caslon Text",
                "EB Garamond",
                "IM Fell English",
                "Crimson Pro",
                "Alegreya"
            ],
            "fallback_strategy": "Prefer metrically stable, licensable fonts with the language coverage required by the map; preserve hierarchy when substitution is necessary.",
            "rules": [
                "Use many place labels; dense naming is part of the style.",
                "Allow slight rotation and curvature to follow rivers, coasts, roads, or regional spread.",
                "Prefer old-style serifs and italics; do not use modern sans-serif labels.",
                "Use long-s characters only with extreme caution; legibility beats antiquarian showing-off."
            ]
        },
        "linework": [
            "Fine engraved black/sepia linework with varied pressure, slight wobble, cross-hatching, and small symbolic marks. Use line density instead of color to differentiate features.",
            "thin dotted or dashed administrative/provincial limits",
            "sheet neatlines and grid lines in strong sepia/black",
            "coastlines engraved with slightly heavier outer stroke and fine water/coastal hatching",
            "rivers as sinuous engraved lines tapering by order",
            "tributaries thin and numerous",
            "waterbody outlines black/sepia with optional pale wash",
            "marshy areas with horizontal strokes, reed marks, or stipple",
            "main roads as paired or slightly heavier lines, sometimes with route emphasis",
            "secondary roads as single fine lines",
            "paths as dotted or broken lines",
            "bridges as tiny line interruptions or symbols",
            "relief by hachures, molehill strokes, and slope marks rather than contours",